{
  "coverage_report_id": "post-car-t-relapse-mechanism-coverage-v0",
  "date": "2026-04-15",
  "disease_program": "multiple-myeloma",
  "title": "Post-CAR T Relapse Mechanism Coverage Report v0",
  "blood_cancer_scope": [
    "multiple myeloma",
    "BCMA-targeted CAR T-cell therapy",
    "post-CAR T relapse",
    "mechanism extraction coverage"
  ],
  "clinical_use_boundary": "research-use-only",
  "parent_map_id": "post-car-t-relapse-mechanism-map-v0",
  "gap_register_ids": [
    "bcma-antigen-escape-evidence-gap-register-v0"
  ],
  "linked_gap_ids": [
    "non-antigen-loss-relapse-buckets-gap-v0"
  ],
  "linked_claim_ids": [
    "bcma-resistance-is-multifactorial-v0"
  ],
  "source_ids": [
    "nci_pdq_myeloma_hp",
    "pubmed_tedder_bhutani_2025_bcma_resistance",
    "pubmed_ledergor_2024_cd4_car_t_exhaustion",
    "pubmed_antigen_escape_bcma_directed_2024",
    "pubmed_yue_2025_bcma_resistance",
    "pubmed_di_meo_2025_sema4a_low_bcma",
    "pubmed_plasma_cell_identity_escape_2025",
    "clinicaltrials_gov",
    "clinicaltrials_gov_api_v2",
    "fda_drugs_at_fda",
    "pubmed"
  ],
  "extraction_record_ids": [
    "di-meo-2025-sema4a-low-bcma-v0",
    "di-meo-2025-target-linked-phenotype-v0",
    "firestone-2024-bcma-antigen-escape-v0",
    "ledergor-2024-cd4-car-t-exhaustion-v0",
    "maura-2025-plasma-cell-identity-escape-v0",
    "nci-pdq-2025-disease-context-v0",
    "tedder-bhutani-2025-bcma-resistance-review-v0",
    "tedder-bhutani-2025-disease-context-v0",
    "yue-2025-bcma-resistance-review-v0"
  ],
  "coverage_basis": {
    "map_path": "disease-programs/multiple-myeloma/mechanisms/post-car-t-relapse-mechanism-map-v0.json",
    "extractions_path": "disease-programs/multiple-myeloma/mechanisms/extractions",
    "counting_method": "Counts public extraction records and extracted signals by mechanism_group_id in the current public repository.",
    "coverage_status_rule": "Zero records means needs-first-extraction; one record means needs-second-source-extraction; two or more records means covered-for-v0-navigation. These are artifact-coverage statuses, not biological rankings."
  },
  "mechanism_coverage": [
    {
      "mechanism_group_id": "bcma-antigen-loss-or-low-density-v0",
      "label": "BCMA antigen loss, low density, or target alteration",
      "signal_count": 5,
      "extraction_record_count": 4,
      "covered_source_count": 4,
      "coverage_status": "covered-for-v0-navigation",
      "under_coverage_flag": false,
      "under_coverage_reason": "At least two extraction records currently map to this mechanism bucket.",
      "source_ids": [
        "pubmed_antigen_escape_bcma_directed_2024",
        "pubmed_di_meo_2025_sema4a_low_bcma",
        "pubmed_plasma_cell_identity_escape_2025",
        "pubmed_tedder_bhutani_2025_bcma_resistance",
        "pubmed_yue_2025_bcma_resistance"
      ],
      "covered_source_ids": [
        "pubmed_antigen_escape_bcma_directed_2024",
        "pubmed_di_meo_2025_sema4a_low_bcma",
        "pubmed_plasma_cell_identity_escape_2025",
        "pubmed_yue_2025_bcma_resistance"
      ],
      "extraction_record_ids": [
        "di-meo-2025-sema4a-low-bcma-v0",
        "firestone-2024-bcma-antigen-escape-v0",
        "maura-2025-plasma-cell-identity-escape-v0",
        "yue-2025-bcma-resistance-review-v0"
      ],
      "extraction_signal_ids": [
        "antigen-dependency-resistance-category-signal-v0",
        "low-bcma-post-car-t-relapse-target-need-signal-v0",
        "prior-bcma-therapy-target-loss-nonresponse-signal-v0",
        "reduced-tnfrsf17-identity-escape-signal-v0",
        "tnfrsf17-biallelic-loss-target-alteration-signal-v0"
      ],
      "next_extraction_need": "Use current BCMA antigen-loss coverage for navigation only; do not rank biological importance from counts.",
      "coverage_notes": [
        "This bucket has the cleanest structured coverage today, but that does not mean antigen escape is dominant.",
        "Review and source-specific extraction are still needed before any mechanism-frequency claim."
      ]
    },
    {
      "mechanism_group_id": "car-t-fitness-exhaustion-persistence-v0",
      "label": "CAR T fitness, exhaustion, expansion, or persistence",
      "signal_count": 5,
      "extraction_record_count": 2,
      "covered_source_count": 2,
      "coverage_status": "covered-for-v0-navigation",
      "under_coverage_flag": false,
      "under_coverage_reason": "At least two extraction records currently map to this mechanism bucket.",
      "source_ids": [
        "pubmed_ledergor_2024_cd4_car_t_exhaustion",
        "pubmed_tedder_bhutani_2025_bcma_resistance",
        "pubmed_yue_2025_bcma_resistance"
      ],
      "covered_source_ids": [
        "pubmed_ledergor_2024_cd4_car_t_exhaustion",
        "pubmed_yue_2025_bcma_resistance"
      ],
      "extraction_record_ids": [
        "ledergor-2024-cd4-car-t-exhaustion-v0",
        "yue-2025-bcma-resistance-review-v0"
      ],
      "extraction_signal_ids": [
        "car-t-persistence-durable-response-signal-v0",
        "cd4-cytotoxic-exhaustion-early-relapse-signal-v0",
        "immune-tumor-microenvironment-resistance-category-signal-v0",
        "myeloma-niche-monocyte-dysfunction-signal-v0",
        "t-cell-driven-resistance-category-signal-v0"
      ],
      "next_extraction_need": "Use current CAR T fitness, exhaustion, expansion, or persistence coverage for navigation only; do not rank biological importance from counts.",
      "coverage_notes": [
        "This bucket now has source-specific coverage from Ledergor 2024 and review-level category coverage from Yue 2025.",
        "Yue 2025 supports extraction-field coverage for T-cell-driven and immune microenvironment categories, not cohort-level comparison."
      ]
    },
    {
      "mechanism_group_id": "plasma-cell-identity-or-lineage-state-escape-v0",
      "label": "Plasma-cell identity or lineage-state escape",
      "signal_count": 5,
      "extraction_record_count": 2,
      "covered_source_count": 2,
      "coverage_status": "covered-for-v0-navigation",
      "under_coverage_flag": false,
      "under_coverage_reason": "At least two extraction records currently map to this mechanism bucket.",
      "source_ids": [
        "pubmed_di_meo_2025_sema4a_low_bcma",
        "pubmed_plasma_cell_identity_escape_2025",
        "pubmed_yue_2025_bcma_resistance"
      ],
      "covered_source_ids": [
        "pubmed_di_meo_2025_sema4a_low_bcma",
        "pubmed_plasma_cell_identity_escape_2025"
      ],
      "extraction_record_ids": [
        "di-meo-2025-target-linked-phenotype-v0",
        "maura-2025-plasma-cell-identity-escape-v0"
      ],
      "extraction_signal_ids": [
        "bcma-low-target-linked-phenotype-context-signal-v0",
        "identity-label-harmonization-boundary-signal-v0",
        "mouse-model-identity-escape-validation-signal-v0",
        "plasma-cell-identity-escape-refractory-signature-signal-v0",
        "sema4a-bcma-density-pairing-phenotype-signal-v0"
      ],
      "next_extraction_need": "Use current plasma-cell identity or lineage-state coverage for navigation only; do not rank biological importance from counts.",
      "coverage_notes": [
        "Second-source coverage now exists from Maura 2025 and Di Meo 2025 source records.",
        "Di Meo 2025 supports target-linked phenotype field coverage, not a harmonized lineage-state ontology or clinical target-readiness claim."
      ]
    },
    {
      "mechanism_group_id": "disease-burden-site-risk-context-v0",
      "label": "Disease burden, site, and high-risk context",
      "signal_count": 8,
      "extraction_record_count": 2,
      "covered_source_count": 4,
      "coverage_status": "covered-for-v0-navigation",
      "under_coverage_flag": false,
      "under_coverage_reason": "At least two extraction records currently map to this mechanism bucket.",
      "source_ids": [
        "clinicaltrials_gov",
        "clinicaltrials_gov_api_v2",
        "nci_pdq_myeloma_hp",
        "pubmed_tedder_bhutani_2025_bcma_resistance"
      ],
      "covered_source_ids": [
        "clinicaltrials_gov",
        "clinicaltrials_gov_api_v2",
        "nci_pdq_myeloma_hp",
        "pubmed_tedder_bhutani_2025_bcma_resistance"
      ],
      "extraction_record_ids": [
        "nci-pdq-2025-disease-context-v0",
        "tedder-bhutani-2025-disease-context-v0"
      ],
      "extraction_signal_ids": [
        "baseline-burden-site-risk-context-field-signal-v0",
        "context-not-causal-mechanism-boundary-signal-v0",
        "nci-pdq-disease-burden-staging-context-signal-v0",
        "nci-pdq-disease-site-plasmacytoma-context-signal-v0",
        "nci-pdq-high-risk-cytogenetic-context-signal-v0",
        "nci-pdq-relapsed-refractory-prior-therapy-context-signal-v0",
        "prior-therapy-bcma-exposure-context-signal-v0",
        "registry-eligibility-context-field-signal-v0"
      ],
      "next_extraction_need": "Use current disease burden, site, and high-risk context coverage for navigation only; do not rank biological importance from counts.",
      "coverage_notes": [
        "Second-source context-field coverage now exists from Tedder and Bhutani 2025 plus the NCI PDQ health-professional summary.",
        "This bucket should capture context variables before any relapse-mechanism comparison is attempted.",
        "NCI PDQ fields support disease-burden, site, high-risk, disease-state, and prior-therapy context labels, not patient-specific risk interpretation, eligibility, availability, efficacy, or safety."
      ]
    },
    {
      "mechanism_group_id": "sequential-or-dual-target-immune-pressure-v0",
      "label": "Sequential or dual-target immune pressure",
      "signal_count": 5,
      "extraction_record_count": 3,
      "covered_source_count": 3,
      "coverage_status": "covered-for-v0-navigation",
      "under_coverage_flag": false,